code,industry_id,Description
33312,null,Construction machinery manufacturing
33313,null,Mining and oil and gas field machinery manufacturing
33321,null,Sawmill and woodworking machinery manufacturing
33322,null,Plastics and rubber industry machinery manufacturing
33329,null,Other industrial machinery manufacturing
33331,null,Commercial and service industry machinery manufacturing
33341,null,"Ventilation, heating, air-conditioning, and commercial refrigeration equipment manufacturing"
33351,null,Metalworking machinery manufacturing
33361,null,"Engine, turbine, and power transmission equipment manufacturing"
33391,null,Pump and compressor manufacturing
33392,null,Material handling equipment manufacturing
33399,null,All other general purpose machinery manufacturing
33411,null,Computer and peripheral equipment manufacturing
33421,null,Telephone apparatus manufacturing
33422,null,Radio and television broadcasting and wireless communications equipment manufacturing
33429,null,Other communications equipment manufacturing
33431,null,Audio and video equipment manufacturing
33441,null,Semiconductor and other electronic component manufacturing
33451,null,"Navigational, measuring, electromedical, and control instruments manufacturing"
33461,null,Manufacturing and reproducing magnetic and optical media
33511,null,Electric lamp bulb and part manufacturing
33512,null,Lighting fixture manufacturing
33521,null,Small electrical appliance manufacturing
33522,null,Major appliance manufacturing
33531,null,Electrical equipment manufacturing
33591,null,Battery manufacturing
33592,null,Communication and energy wire and cable manufacturing
33593,null,Wiring device manufacturing
33599,null,All other electrical equipment and component manufacturing
33611,null,Automobile and light duty motor vehicle manufacturing
33612,null,Heavy duty truck manufacturing
33621,null,Motor vehicle body and trailer manufacturing
33631,null,Motor vehicle gasoline engine and engine parts manufacturing
33632,null,Motor vehicle electrical and electronic equipment manufacturing
33633,null,Motor vehicle steering and suspension components (except spring) manufacturing
33634,null,Motor vehicle brake system manufacturing
33635,null,Motor vehicle transmission and power train parts manufacturing
33636,null,Motor vehicle seating and interior trim manufacturing
33637,null,Motor vehicle metal stamping
33639,null,Other motor vehicle parts manufacturing
33641,null,Aerospace product and parts manufacturing
33651,null,Railroad rolling stock manufacturing
33661,null,Ship and boat building
33699,null,Other transportation equipment manufacturing
33711,null,Wood kitchen cabinet and countertop manufacturing
33712,null,Household and institutional furniture manufacturing
33721,null,Office furniture (including fixtures) manufacturing
33791,null,Mattress manufacturing
33792,null,Blind and shade manufacturing
33911,null,Medical equipment and supplies manufacturing
33991,null,Jewelry and silverware manufacturing
33992,null,Sporting and athletic goods manufacturing
33993,null,"Doll, toy, and game manufacturing"
33994,null,Office supplies (except paper) manufacturing
33995,null,Sign manufacturing
33999,null,All other miscellaneous manufacturing
42311,null,Automobile and other motor vehicle merchant wholesalers
42312,null,Motor vehicle supplies and new parts merchant wholesalers
42313,null,Tire and tube merchant wholesalers
42314,null,Motor vehicle parts (used) merchant wholesalers
42321,null,Furniture merchant wholesalers
42322,null,Home furnishing merchant wholesalers
42331,null,"Lumber, plywood, millwork, and wood panel merchant wholesalers"
42332,null,"Brick, stone, and related construction material merchant wholesalers"
42333,null,"Roofing, siding, and insulation material merchant wholesalers"
42339,null,Other construction material merchant wholesalers
42341,null,Photographic equipment and supplies merchant wholesalers
42342,null,Office equipment merchant wholesalers
42343,null,Computer and computer peripheral equipment and software merchant wholesalers
42344,null,Other commercial equipment merchant wholesalers
42345,null,"Medical, dental, and hospital equipment and supplies merchant wholesalers"
42346,null,Ophthalmic goods merchant wholesalers
42349,null,Other professional equipment and supplies merchant wholesalers
42351,null,Metal service centers and other metal merchant wholesalers
42352,null,Coal and other mineral and ore merchant wholesalers
42361,null,"Electrical apparatus and equipment, wiring supplies, and related equipment merchant wholesalers"
42362,null,"Electrical and electronic appliance, television, and radio set merchant wholesalers"
42369,null,Other electronic parts and equipment merchant wholesalers
42371,null,Hardware merchant wholesalers
42372,null,Plumbing and heating equipment and supplies (hydronics) merchant wholesalers
42373,null,Warm air heating and air-conditioning equipment and supplies merchant wholesalers
42374,null,Refrigeration equipment and supplies merchant wholesalers
42381,null,Construction and mining (except oil well) machinery and equipment merchant wholesalers
42382,null,Farm and garden machinery and equipment merchant wholesalers
42383,null,Industrial machinery and equipment merchant wholesalers
42384,null,Industrial supplies merchant wholesalers
42385,null,Service establishment equipment and supplies merchant wholesalers
42386,null,Transportation equipment and supplies (except motor vehicle) merchant wholesalers
42391,null,Sporting and recreational goods and supplies merchant wholesalers
42392,null,Toy and hobby goods and supplies merchant wholesalers
42393,null,Recyclable material merchant wholesalers
42394,null,"Jewelry, watch, precious stone, and precious metal merchant wholesalers"
42399,null,Other miscellaneous durable goods merchant wholesalers
42411,null,Printing and writing paper merchant wholesalers
42412,null,Stationery and office supplies merchant wholesalers
42413,null,Industrial and personal service paper merchant wholesalers
42421,null,Drugs and druggists' sundries merchant wholesalers
42431,null,"Piece goods, notions, and other dry goods merchant wholesalers"
42432,null,Men's and boys' clothing and furnishings merchant wholesalers
42433,null,"Women's, children's, and infants' clothing and accessories merchant wholesalers"
42434,null,Footwear merchant wholesalers
42441,null,General line grocery merchant wholesalers
42442,null,Packaged frozen food merchant wholesalers
42443,null,Dairy product (except dried or canned) merchant wholesalers
42444,null,Poultry and poultry product merchant wholesalers
42445,null,Confectionery merchant wholesalers
42446,null,Fish and seafood merchant wholesalers
42447,null,Meat and meat product merchant wholesalers
42448,null,Fresh fruit and vegetable merchant wholesalers
42449,null,Other grocery and related products merchant wholesalers
42451,null,Grain and field bean merchant wholesalers
42452,null,Livestock merchant wholesalers
42459,null,Other farm product raw material merchant wholesalers
42461,null,Plastics materials and basic forms and shapes merchant wholesalers
42469,null,Other chemical and allied products merchant wholesalers
42471,null,Petroleum bulk stations and terminals 
42472,null,Petroleum and petroleum products merchant wholesalers (except bulk stations and terminals) 
42481,null,Beer and ale merchant wholesalers
42482,null,Wine and distilled alcoholic beverage merchant wholesalers
42491,null,Farm supplies merchant wholesalers
42492,null,"Book, periodical, and newspaper merchant wholesalers"
42493,null,"Flower, nursery stock, and florists' supplies merchant wholesalers"
42494,null,Tobacco and tobacco product merchant wholesalers
42495,null,"Paint, varnish, and supplies merchant wholesalers"
42499,null,Other miscellaneous nondurable goods merchant wholesalers
42511,null,Business to business electronic markets
42512,null,Wholesale trade agents and brokers
44111,null,New car dealers
44112,null,Used car dealers
44121,null,Recreational vehicle dealers
44122,null,"Motorcycle, boat, and other motor vehicle dealers"
44131,null,Automotive parts and accessories stores
44132,null,Tire dealers
44211,null,Furniture stores
44221,null,Floor covering stores
44229,null,Other home furnishings stores
44311,null,"Appliance, television, and other electronics stores"
44312,null,Computer and software stores
44313,null,Camera and photographic supplies stores
44411,null,Home centers
44412,null,Paint and wallpaper stores
44413,null,Hardware stores
44419,null,Other building material dealers
44421,null,Outdoor power equipment stores
44422,null,"Nursery, garden center, and farm supply stores"
44511,null,Supermarkets and other grocery (except convenience) stores
44512,null,Convenience stores
44521,null,Meat markets
44522,null,Fish and seafood markets
44523,null,Fruit and vegetable markets
44529,null,Other specialty food stores
44531,null,"Beer, wine, and liquor stores"
44611,null,Pharmacies and drug stores
44612,null,"Cosmetics, beauty supplies, and perfume stores"
44613,null,Optical goods stores
44619,null,Other health and personal care stores
44711,null,Gasoline stations with convenience stores
44719,null,Other gasoline stations
44811,null,Men's clothing stores
44812,null,Women's clothing stores
44813,null,Children's and infants' clothing stores
44814,null,Family clothing stores
44815,null,Clothing accessories stores
44819,null,Other clothing stores
44821,null,Shoe stores
44831,null,Jewelry stores
44832,null,Luggage and leather goods stores
45111,null,Sporting goods stores
45112,null,"Hobby, toy, and game stores"
45113,null,"Sewing, needlework, and piece goods stores"
45114,null,Musical instrument and supplies stores
45121,null,Book stores and news dealers
45122,null,"Prerecorded tape, compact disc, and record stores"
45211,null,Department stores
45291,null,Warehouse clubs and supercenters
45299,null,All other general merchandise stores
45311,null,Florists
45321,null,Office supplies and stationery stores
45322,null,"Gift, novelty, and souvenir stores"
45331,null,Used merchandise stores
45391,null,Pet and pet supplies stores
45392,null,Art dealers
45393,null,Manufactured (mobile) home dealers
45399,null,All other miscellaneous store retailers
45411,null,Electronic shopping and mail-order houses
45421,null,Vending machine operators
45431,null,Fuel dealers
45439,null,Other direct selling establishments
48111,null,Scheduled air transportation
48121,null,Nonscheduled air transportation
48311,null,"Deep sea, coastal, and great lakes water transportation"
48321,null,Inland water transportation
48411,null,"General freight trucking, local"
48412,null,"General freight trucking, long-distance"
48421,null,Used household and office goods moving
48422,null,"Specialized freight (except used goods) trucking, local"
48423,null,"Specialized freight (except used goods) trucking, long-distance"
48511,null,Urban transit systems
48521,null,Interurban and rural bus transportation
48531,null,Taxi service
48532,null,Limousine service
48541,null,School and employee bus transportation
48551,null,Charter bus industry
48599,null,Other transit and ground passenger transportation
48611,null,Pipeline transportation of crude oil
48621,null,Pipeline transportation of natural gas
48691,null,Pipeline transportation of refined petroleum products
48699,null,All other pipeline transportation
48711,null,"Scenic and sightseeing transportation, land"
48721,null,"Scenic and sightseeing transportation, water"
48799,null,"Scenic and sightseeing transportation, other"
48811,null,Airport operations
48819,null,Other support activities for air transportation
48821,null,Support activities for rail transportation
48831,null,Port and harbor operations
48832,null,Marine cargo handling
48833,null,Navigational services to shipping
48839,null,Other support activities for water transportation
48841,null,Motor vehicle towing
48849,null,Other support activities for road transportation
48851,null,Freight transportation arrangement
48899,null,Other support activities for transportation
49211,null,Couriers and express delivery services
49221,null,Local messengers and local delivery
49311,null,General warehousing and storage
49312,null,Refrigerated warehousing and storage
49313,null,Farm product warehousing and storage
49319,null,Other warehousing and storage
51111,null,Newspaper publishers
51112,null,Periodical publishers
51113,null,Book publishers
51114,null,Directory and mailing list publishers
51119,null,Other publishers
51121,null,Software publishers
51211,null,Motion picture and video production
51212,null,Motion picture and video distribution
51213,null,Motion picture and video exhibition
51219,null,Postproduction services and other motion picture and video industries
51221,null,Record production
51222,null,Integrated record production/distribution
51223,null,Music publishers
51224,null,Sound recording studios
51229,null,Other sound recording industries
51511,null,Radio broadcasting
51512,null,Television broadcasting
51521,null,Cable and other subscription programming
51711,null,Wired telecommunications carriers
51721,null,Wireless telecommunications carriers (except satellite)
51741,null,Satellite telecommunications
51791,null,Other telecommunications
51821,null,"Data processing, hosting, and related services"
51911,null,News syndicates
51912,null,Libraries and archives
51913,null,Internet publishing and broadcasting and web search portals
51919,null,All other information services
52111,null,Monetary authorities - central bank
52211,null,Commercial banking
52212,null,Savings institutions
52213,null,Credit unions
52219,null,Other depository credit intermediation
52221,null,Credit card issuing
52222,null,Sales financing
52229,null,Other nondepository credit intermediation
52231,null,Mortgage and nonmortgage loan brokers
52232,null,"Financial transactions processing, reserve, and clearinghouse activities"
52239,null,Other activities related to credit intermediation
52311,null,Investment banking and securities dealing
52312,null,Securities brokerage
52313,null,Commodity contracts dealing
52314,null,Commodity contracts brokerage
52321,null,Securities and commodity exchanges
52391,null,Miscellaneous intermediation
52392,null,Portfolio management
52393,null,Investment advice
52399,null,All other financial investment activities
52411,null,"Direct life, health, and medical insurance carriers"
52412,null,"Direct insurance (except life, health, and medical) carriers"
52413,null,Reinsurance carriers
52421,null,Insurance agencies and brokerages
52429,null,Other insurance related activities
53111,null,Lessors of residential buildings and dwellings
53112,null,Lessors of nonresidential buildings (except miniwarehouses)
53113,null,Lessors of miniwarehouses and self-storage units
53119,null,Lessors of other real estate property
53121,null,Offices of real estate agents and brokers
53131,null,Real estate property managers
53132,null,Offices of real estate appraisers
53139,null,Other activities related to real estate
53211,null,Passenger car rental and leasing
53212,null,"Truck, utility trailer, and RV (recreational vehicle) rental and leasing"
53221,null,Consumer electronics and appliances rental
53222,null,Formal wear and costume rental
53223,null,Video tape and disc rental
53229,null,Other consumer goods rental
53231,null,General rental centers
53241,null,"Construction, transportation, mining, and forestry machinery and equipment rental and leasing"
53242,null,Office machinery and equipment rental and leasing
53249,null,Other commercial and industrial machinery and equipment rental and leasing
53311,null,Lessors of nonfinancial intangible assets (except copyrighted works)
54111,null,Offices of lawyers
54119,null,Other legal services
54121,null,"Accounting, tax preparation, bookkeeping, and payroll services"
54131,null,Architectural services
54132,null,Landscape architectural services
54133,null,Engineering services
54134,null,Drafting services
54135,null,Building inspection services
54136,null,Geophysical surveying and mapping services
54137,null,Surveying and mapping (except geophysical) services
54138,null,Testing laboratories
54141,null,Interior design services
54142,null,Industrial design services
54143,null,Graphic design services
54149,null,Other specialized design services
54151,null,Computer systems design and related services
54161,null,Management consulting services
54162,null,Environmental consulting services
54169,null,Other scientific and technical consulting services
54171,null,"Research and development in the physical, engineering, and life sciences"
54172,null,Research and development in the social sciences and humanities
54181,null,Advertising agencies
54182,null,Public relations agencies
54183,null,Media buying agencies
54184,null,Media representatives
54185,null,Display advertising
54186,null,Direct mail advertising
54187,null,Advertising material distribution services
54189,null,Other services related to advertising
54191,null,Marketing research and public opinion polling
54192,null,Photographic services
54193,null,Translation and interpretation services
54194,null,Veterinary services
54199,null,"All other professional, scientific, and technical services"
55111,null,Management of companies and enterprises
56111,null,Office administrative services
56121,null,Facilities support services
56131,null,Employment placement agencies and executive search services
56132,null,Temporary help services
56133,null,Professional employer organizations
56141,null,Document preparation services
56142,null,Telephone call centers
56143,null,Business service centers
56144,null,Collection agencies
56145,null,Credit bureaus
56149,null,Other business support services
56151,null,Travel agencies
56152,null,Tour operators
56159,null,Other travel arrangement and reservation services
56161,null,"Investigation, guard, and armored car services"
56162,null,Security systems services
56171,null,Exterminating and pest control services
56172,null,Janitorial services
56173,null,Landscaping services
56174,null,Carpet and upholstery cleaning services
56179,null,Other services to buildings and dwellings
56191,null,Packaging and labeling services
56192,null,Convention and trade show organizers
56199,null,All other support services
56211,null,Waste collection
56221,null,Waste treatment and disposal
56291,null,Remediation services
56292,null,Materials recovery facilities
56299,null,All other waste management services
61141,null,Business and secretarial schools
61142,null,Computer training
61143,null,Professional and management development training
61151,null,Technical and trade schools
61161,null,Fine arts schools
61162,null,Sports and recreation instruction
61163,null,Language schools
61169,null,All other schools and instruction
61171,null,Educational support services
62111,null,Offices of physicians
62121,null,Offices of dentists
62131,null,Offices of chiropractors
62132,null,Offices of optometrists
62133,null,Offices of mental health practitioners (except physicians)
62134,null,"Offices of physical, occupational and speech therapists, and audiologists"
62139,null,Offices of all other health practitioners
62141,null,Family planning centers
62142,null,Outpatient mental health and substance abuse centers
62149,null,Other outpatient care centers
62151,null,Medical and diagnostic laboratories
62161,null,Home health care services
62191,null,Ambulance services
62199,null,All other ambulatory health care services
62211,null,General medical and surgical hospitals
62221,null,Psychiatric and substance abuse hospitals
62231,null,Specialty (except psychiatric and substance abuse) hospitals
62311,null,Nursing care facilities
62321,null,Residential mental retardation facilities
62322,null,Residential mental health and substance abuse facilities
62331,null,Community care facilities for the elderly
62399,null,Other residential care facilities
62411,null,Child and youth services
62412,null,Services for the elderly and persons with disabilities
62419,null,Other individual and family services
62421,null,Community food services
62422,null,Community housing services
62423,null,Emergency and other relief services
62431,null,Vocational rehabilitation services
62441,null,Child day care services
71111,null,Theater companies and dinner theaters
71112,null,Dance companies
71113,null,Musical groups and artists
71119,null,Other performing arts companies
71121,null,Spectator sports
71131,null,"Promoters of performing arts, sports, and similar events with facilities"
71132,null,"Promoters of performing arts, sports, and similar events without facilities"
71141,null,"Agents and managers for artists, athletes, entertainers, and other public figures"
71151,null,"Independent artists, writers, and performers"
71211,null,Museums
71212,null,Historical sites
71213,null,Zoos and botanical gardens
71219,null,Nature parks and other similar institutions
71311,null,Amusement and theme parks
71312,null,Amusement arcades
71321,null,Casinos (except casino hotels)
71329,null,Other gambling industries
71391,null,Golf courses and country clubs
71392,null,Skiing facilities
71393,null,Marinas
71394,null,Fitness and recreational sports centers
71395,null,Bowling centers
71399,null,All other amusement and recreation industries
72111,null,Hotels (except casino hotels) and motels
72112,null,Casino hotels
72119,null,Other traveler accommodation
72121,null,RV (recreational vehicle) parks and recreational camps
72131,null,Rooming and boarding houses
72211,null,Full-service restaurants
72221,null,Limited-service eating places
72231,null,Food service contractors
72232,null,Caterers
72233,null,Mobile food services
72241,null,Drinking places (alcoholic beverages)
81111,null,Automotive mechanical and electrical repair and maintenance
81112,null,"Automotive body, paint, interior, and glass repair"
81119,null,Other automotive repair and maintenance
81121,null,Electronic and precision equipment repair and maintenance
81131,null,Commercial and industrial machinery and equipment (except automotive and electronic) repair and maintenance
81141,null,Home and garden equipment and appliance repair and maintenance
81142,null,Reupholstery and furniture repair
81143,null,Footwear and leather goods repair
81149,null,Other personal and household goods repair and maintenance
81211,null,"Hair, nail, and skin care services"
81219,null,Other personal care services
81221,null,Funeral homes and funeral services
81222,null,Cemeteries and crematories
81231,null,Coin-operated laundries and drycleaners
81232,null,Drycleaning and laundry services (except coin-operated)
81233,null,Linen and uniform supply
81291,null,Pet care (except veterinary) services
81292,null,Photofinishing
81293,null,Parking lots and garages
81299,null,All other personal services
81321,null,Grantmaking and giving services
81331,null,Social advocacy organizations
81341,null,Civic and social organizations
81391,null,Business associations
81392,null,Professional organizations
81399,null,"Other similar organizations (except business, professional, labor, and political organizations)"
211111,null,Crude petroleum and natural gas extraction
211112,null,Natural gas liquid extraction
212111,null,Bituminous coal and lignite surface mining
212112,null,Bituminous coal underground mining
212113,null,Anthracite mining
212210,null,Iron ore mining
212221,null,Gold ore mining
212222,null,Silver ore mining
212231,null,Lead ore and zinc ore mining
212234,null,Copper ore and nickel ore mining
212291,null,Uranium-radium-vanadium ore mining
212299,null,All other metal ore mining
212311,null,Dimension stone mining and quarrying
212312,null,Crushed and broken limestone mining and quarrying
212313,null,Crushed and broken granite mining and quarrying
212319,null,Other crushed and broken stone mining and quarrying
212321,null,Construction sand and gravel mining
212322,null,Industrial sand mining
212324,null,Kaolin and ball clay mining
212325,null,Clay and ceramic and refractory minerals mining
212391,null,"Potash, soda, and borate mineral mining"
212392,null,Phosphate rock mining
212393,null,Other chemical and fertilizer mineral mining
212399,null,All other nonmetallic mineral mining
213111,null,Drilling oil and gas wells
213112,null,Support activities for oil and gas operations
213113,null,Support activities for coal mining
213114,null,Support activities for metal mining
213115,null,Support activities for nonmetallic minerals (except fuels) mining
221111,null,Hydroelectric power generation
221112,null,Fossil fuel electric power generation
221113,null,Nuclear electric power generation
221119,null,Other electric power generation
221121,null,Electric bulk power transmission and control
221122,null,Electric power distribution
221210,null,Natural gas distribution
221310,null,Water supply and irrigation systems
221320,null,Sewage treatment facilities
221330,null,Steam and air-conditioning supply
236115,null,New single-family housing construction (except for-sale builders)
236116,null,New multifamily housing construction (except for-sale builders)
236117,null,New housing for-sale builders
236118,null,Residential remodelers
236210,null,Industrial building construction
236220,null,Commercial and institutional building construction
237110,null,Water and sewer line and related structures construction
237120,null,Oil and gas pipeline and related structures construction
237130,null,Power and communication line and related structures construction
