code,industry_id,Description
237210,null,Land subdivision
237310,null,"Highway, street, and bridge construction"
237990,null,Other heavy and civil engineering construction
238110,null,Poured concrete foundation and structure contractors
238120,null,Structural steel and precast concrete contractors
238130,null,Framing contractors
238140,null,Masonry contractors
238150,null,Glass and glazing contractors
238160,null,Roofing contractors
238170,null,Siding contractors
238190,null,"Other foundation, structure, and building exterior contractors"
238210,null,Electrical contractors and other wiring installation contractors
238220,null,"Plumbing, heating, and air-conditioning contractors"
238290,null,Other building equipment contractors
238310,null,Drywall and insulation contractors
238320,null,Painting and wall covering contractors
238330,null,Flooring contractors
238340,null,Tile and terrazzo contractors
238350,null,Finish carpentry contractors
238390,null,Other building finishing contractors
238910,null,Site preparation contractors
238990,null,All other specialty trade contractors
311111,null,Dog and cat food manufacturing
311119,null,Other animal food manufacturing
311211,null,Flour milling
311212,null,Rice milling
311213,null,Malt manufacturing
311221,null,Wet corn milling
311222,null,Soybean processing
311223,null,Other oilseed processing
311225,null,Fats and oils refining and blending
311230,null,Breakfast cereal manufacturing
311311,null,Sugarcane mills
311312,null,Cane sugar refining
311313,null,Beet sugar manufacturing
311320,null,Chocolate and confectionery manufacturing from cacao beans
311330,null,Confectionery manufacturing from purchased chocolate
311340,null,Nonchocolate confectionery manufacturing
311411,null,"Frozen fruit, juice, and vegetable manufacturing"
311412,null,Frozen specialty food manufacturing
311421,null,Fruit and vegetable canning
311422,null,Specialty canning
311423,null,Dried and dehydrated food manufacturing
311511,null,Fluid milk manufacturing
311512,null,Creamery butter manufacturing
311513,null,Cheese manufacturing
311514,null,"Dry, condensed, and evaporated dairy product manufacturing"
311520,null,Ice cream and frozen dessert manufacturing
311611,null,Animal (except poultry) slaughtering
311612,null,Meat processed from carcasses
311613,null,Rendering and meat byproduct processing
311615,null,Poultry processing
311711,null,Seafood canning
311712,null,Fresh and frozen seafood processing
311811,null,Retail bakeries
311812,null,Commercial bakeries
311813,null,"Frozen cakes, pies, and other pastries manufacturing"
311821,null,Cookie and cracker manufacturing
311822,null,Flour mixes and dough manufacturing from purchased flour
311823,null,Dry pasta manufacturing
311830,null,Tortilla manufacturing
311911,null,Roasted nuts and peanut butter manufacturing
311919,null,Other snack food manufacturing
311920,null,Coffee and tea manufacturing
311930,null,Flavoring syrup and concentrate manufacturing
311941,null,"Mayonnaise, dressing, and other prepared sauce manufacturing"
311942,null,Spice and extract manufacturing
311991,null,Perishable prepared food manufacturing
311999,null,All other miscellaneous food manufacturing
312111,null,Soft drink manufacturing
312112,null,Bottled water manufacturing
312113,null,Ice manufacturing
312120,null,Breweries
312130,null,Wineries
312140,null,Distilleries
312210,null,Tobacco stemming and redrying
312221,null,Cigarette manufacturing
312229,null,Other tobacco product manufacturing
313111,null,Yarn spinning mills
313112,null,"Yarn texturizing, throwing, and twisting mills"
313113,null,Thread mills
313210,null,Broadwoven fabric mills
313221,null,Narrow fabric mills
313222,null,Schiffli machine embroidery
313230,null,Nonwoven fabric mills
313241,null,Weft knit fabric mills
313249,null,Other knit fabric and lace mills
313311,null,Broadwoven fabric finishing mills
313312,null,Textile and fabric finishing (except broadwoven fabric) mills
313320,null,Fabric coating mills
314110,null,Carpet and rug mills
314121,null,Curtain and drapery mills
314129,null,Other household textile product mills
314911,null,Textile bag mills
314912,null,Canvas and related product mills
314991,null,"Rope, cordage, and twine mills"
314992,null,Tire cord and tire fabric mills
314999,null,All other miscellaneous textile product mills
315111,null,Sheer hosiery mills
315119,null,Other hosiery and sock mills
315191,null,Outerwear knitting mills
315192,null,Underwear and nightwear knitting mills
315211,null,Men's and boys' cut and sew apparel contractors
315212,null,"Women's, girls', and infants' cut and sew apparel contractors"
315221,null,Men's and boys' cut and sew underwear and nightwear manufacturing
315222,null,"Men's and boys' cut and sew suit, coat, and overcoat manufacturing"
315223,null,Men's and boys' cut and sew shirt (except work shirt) manufacturing
315224,null,"Men's and boys' cut and sew trouser, slack, and jean manufacturing"
315225,null,Men's and boys' cut and sew work clothing manufacturing
315228,null,Men's and boys' cut and sew other outerwear manufacturing
315231,null,"Women's and girls' cut and sew lingerie, loungewear, and nightwear manufacturing"
315232,null,Women's and girls' cut and sew blouse and shirt manufacturing
315233,null,Women's and girls' cut and sew dress manufacturing
315234,null,"Women's and girls' cut and sew suit, coat, tailored jacket, and skirt manufacturing"
315239,null,Women's and girls' cut and sew other outerwear manufacturing
315291,null,Infants' cut and sew apparel manufacturing
315292,null,Fur and leather apparel manufacturing
315299,null,All other cut and sew apparel manufacturing
315991,null,"Hat, cap, and millinery manufacturing"
315992,null,Glove and mitten manufacturing
315993,null,Men's and boys' neckwear manufacturing
315999,null,Other apparel accessories and other apparel manufacturing
316110,null,Leather and hide tanning and finishing
316211,null,Rubber and plastics footwear manufacturing
316213,null,Men's footwear (except athletic) manufacturing
316214,null,Women's footwear (except athletic) manufacturing
316219,null,Other footwear manufacturing
316991,null,Luggage manufacturing
316992,null,Women's handbag and purse manufacturing
316993,null,Personal leather good (except women's handbag and purse) manufacturing
316999,null,All other leather good and allied product manufacturing
321113,null,Sawmills
321114,null,Wood preservation
321211,null,Hardwood veneer and plywood manufacturing
321212,null,Softwood veneer and plywood manufacturing
321213,null,Engineered wood member (except truss) manufacturing
321214,null,Truss manufacturing
321219,null,Reconstituted wood product manufacturing
321911,null,Wood window and door manufacturing
321912,null,"Cut stock, resawing lumber, and planing"
321918,null,Other millwork (including flooring)
321920,null,Wood container and pallet manufacturing
321991,null,Manufactured home (mobile home) manufacturing
321992,null,Prefabricated wood building manufacturing
321999,null,All other miscellaneous wood product manufacturing
322110,null,Pulp mills
322121,null,Paper (except newsprint) mills
322122,null,Newsprint mills
322130,null,Paperboard mills
322211,null,Corrugated and solid fiber box manufacturing
322212,null,Folding paperboard box manufacturing
322213,null,Setup paperboard box manufacturing
322214,null,"Fiber can, tube, drum, and similar products manufacturing"
322215,null,Nonfolding sanitary food container manufacturing
322221,null,Coated and laminated packaging paper manufacturing
322222,null,Coated and laminated paper manufacturing
322223,null,Coated paper bag and pouch manufacturing
322224,null,Uncoated paper and multiwall bag manufacturing
322225,null,Laminated aluminum foil manufacturing for flexible packaging uses
322226,null,Surface-coated paperboard manufacturing
322231,null,Die-cut paper and paperboard office supplies manufacturing
322232,null,Envelope manufacturing
322233,null,"Stationery, tablet, and related product manufacturing"
322291,null,Sanitary paper product manufacturing
322299,null,All other converted paper product manufacturing
323110,null,Commercial lithographic printing
323111,null,Commercial gravure printing
323112,null,Commercial flexographic printing
323113,null,Commercial screen printing
323114,null,Quick printing
323115,null,Digital printing
323116,null,Manifold business forms printing
323117,null,Books printing
323118,null,"Blankbook, looseleaf binders, and devices manufacturing"
323119,null,Other commercial printing
323121,null,Tradebinding and related work
323122,null,Prepress services
324110,null,Petroleum refineries
324121,null,Asphalt paving mixture and block manufacturing
324122,null,Asphalt shingle and coating materials manufacturing
324191,null,Petroleum lubricating oil and grease manufacturing
324199,null,All other petroleum and coal products manufacturing
325110,null,Petrochemical manufacturing
325120,null,Industrial gas manufacturing
325131,null,Inorganic dye and pigment manufacturing
325132,null,Synthetic organic dye and pigment manufacturing
325181,null,Alkalies and chlorine manufacturing
325182,null,Carbon black manufacturing
325188,null,All other basic inorganic chemical manufacturing
325191,null,Gum and wood chemical manufacturing
325192,null,Cyclic crude and intermediate manufacturing
325193,null,Ethyl alcohol manufacturing
325199,null,All other basic organic chemical manufacturing
325211,null,Plastics material and resin manufacturing
325212,null,Synthetic rubber manufacturing
325221,null,Cellulosic organic fiber manufacturing
325222,null,Noncellulosic organic fiber manufacturing
325311,null,Nitrogenous fertilizer manufacturing
325312,null,Phosphatic fertilizer manufacturing
325314,null,Fertilizer (mixing only) manufacturing
325320,null,Pesticide and other agricultural chemical manufacturing
325411,null,Medicinal and botanical manufacturing
325412,null,Pharmaceutical preparation manufacturing
325413,null,In-vitro diagnostic substance manufacturing
325414,null,Biological product (except diagnostic) manufacturing
325510,null,Paint and coating manufacturing
325520,null,Adhesive manufacturing
325611,null,Soap and other detergent manufacturing
325612,null,Polish and other sanitation good manufacturing
325613,null,Surface active agent manufacturing
325620,null,Toilet preparation manufacturing
325910,null,Printing ink manufacturing
325920,null,Explosives manufacturing
325991,null,Custom compounding of purchased resins
325992,null,"Photographic film, paper, plate, and chemical manufacturing"
325998,null,All other miscellaneous chemical product and preparation manufacturing
326111,null,Plastics bag and pouch manufacturing
326112,null,Plastics packaging film and sheet (including laminated) manufacturing
326113,null,Unlaminated plastics film and sheet (except packaging) manufacturing
326121,null,Unlaminated plastics profile shape manufacturing
326122,null,Plastics pipe and pipe fitting manufacturing
326130,null,"Laminated plastics plate, sheet (except packaging), and shape manufacturing"
326140,null,Polystyrene foam product manufacturing
326150,null,Urethane and other foam product (except polystyrene) manufacturing
326160,null,Plastics bottle manufacturing
326191,null,Plastics plumbing fixture manufacturing
326192,null,Resilient floor covering manufacturing
326199,null,All other plastics product manufacturing
326211,null,Tire manufacturing (except retreading)
326212,null,Tire retreading
326220,null,Rubber and plastics hoses and belting manufacturing
326291,null,Rubber product manufacturing for mechanical use
326299,null,All other rubber product manufacturing
327111,null,Vitreous china plumbing fixture and china and earthenware bathroom accessories manufacturing
327112,null,"Vitreous china, fine earthenware, and other pottery product manufacturing"
327113,null,Porcelain electrical supply manufacturing
327121,null,Brick and structural clay tile manufacturing
327122,null,Ceramic wall and floor tile manufacturing
327123,null,Other structural clay product manufacturing
327124,null,Clay refractory manufacturing
327125,null,Nonclay refractory manufacturing
327211,null,Flat glass manufacturing
327212,null,Other pressed and blown glass and glassware manufacturing
327213,null,Glass container manufacturing
327215,null,Glass product manufacturing made of purchased glass
327310,null,Cement manufacturing
327320,null,Ready-mix concrete manufacturing
327331,null,Concrete block and brick manufacturing
327332,null,Concrete pipe manufacturing
327390,null,Other concrete product manufacturing
327410,null,Lime manufacturing
327420,null,Gypsum product manufacturing
327910,null,Abrasive product manufacturing
327991,null,Cut stone and stone product manufacturing
327992,null,Ground or treated mineral and earth manufacturing
327993,null,Mineral wool manufacturing
327999,null,All other miscellaneous nonmetallic mineral product manufacturing
331111,null,Iron and steel mills
331112,null,Electrometallurgical ferroalloy product manufacturing
331210,null,Iron and steel pipe and tube manufacturing from purchased steel
331221,null,Rolled steel shape manufacturing
331222,null,Steel wire drawing
331311,null,Alumina refining
331312,null,Primary aluminum production
331314,null,Secondary smelting and alloying of aluminum
331315,null,"Aluminum sheet, plate, and foil manufacturing"
331316,null,Aluminum extruded product manufacturing
331319,null,Other aluminum rolling and drawing
331411,null,Primary smelting and refining of copper
331419,null,Primary smelting and refining of nonferrous metal (except copper and aluminum)
331421,null,"Copper rolling, drawing, and extruding"
331422,null,Copper wire (except mechanical) drawing
331423,null,"Secondary smelting, refining, and alloying of copper"
331491,null,"Nonferrous metal (except copper and aluminum) rolling, drawing, extruding, and alloying"
331492,null,"Secondary smelting, refining, and alloying of nonferrous metal (except copper and aluminum)"
331511,null,Iron foundries
331512,null,Steel investment foundries
331513,null,Steel foundries (except investment)
331521,null,Aluminum die-casting foundries
331522,null,Nonferrous (except aluminum) die-casting foundries
331524,null,Aluminum foundries (except die-casting)
331525,null,Copper foundries (except die-casting)
331528,null,Other nonferrous foundries (except die-casting)
332111,null,Iron and steel forging
332112,null,Nonferrous forging
332114,null,Custom roll forming
332115,null,Crown and closure manufacturing
332116,null,Metal stamping
332117,null,Powder metallurgy part manufacturing
332211,null,Cutlery and flatware (except precious) manufacturing
332212,null,Hand and edge tool manufacturing
332213,null,Saw blade and handsaw manufacturing
332214,null,"Kitchen utensil, pot, and pan manufacturing"
332311,null,Prefabricated metal building and component manufacturing
332312,null,Fabricated structural metal manufacturing
332313,null,Plate work manufacturing
332321,null,Metal window and door manufacturing
332322,null,Sheet metal work manufacturing
332323,null,Ornamental and architectural metal work manufacturing
332410,null,Power boiler and heat exchanger manufacturing
332420,null,Metal tank (heavy gauge) manufacturing
332431,null,Metal can manufacturing
332439,null,Other metal container manufacturing
332510,null,Hardware manufacturing
332611,null,Spring (heavy gauge) manufacturing
332612,null,Spring (light gauge) manufacturing
332618,null,Other fabricated wire product manufacturing
332710,null,Machine shops
332721,null,Precision turned product manufacturing
332722,null,"Bolt, nut, screw, rivet, and washer manufacturing"
332811,null,Metal heat treating
332812,null,"Metal coating, engraving (except jewelry and silverware), and allied services to manufacturers"
332813,null,"Electroplating, plating, polishing, anodizing, and coloring"
332911,null,Industrial valve manufacturing
332912,null,Fluid power valve and hose fitting manufacturing
332913,null,Plumbing fixture fitting and trim manufacturing
332919,null,Other metal valve and pipe fitting manufacturing
332991,null,Ball and roller bearing manufacturing
332992,null,Small arms ammunition manufacturing
332993,null,Ammunition (except small arms) manufacturing
332994,null,Small arms manufacturing
332995,null,Other ordnance and accessories manufacturing
332996,null,Fabricated pipe and pipe fitting manufacturing
332997,null,Industrial pattern manufacturing
332998,null,Enameled iron and metal sanitary ware manufacturing
332999,null,All other miscellaneous fabricated metal product manufacturing
333111,null,Farm machinery and equipment manufacturing
333112,null,Lawn and garden tractor and home lawn and garden equipment manufacturing
333120,null,Construction machinery manufacturing
333131,null,Mining machinery and equipment manufacturing
333132,null,Oil and gas field machinery and equipment manufacturing
333210,null,Sawmill and woodworking machinery manufacturing
333220,null,Plastics and rubber industry machinery manufacturing
333291,null,Paper industry machinery manufacturing
333292,null,Textile machinery manufacturing
333293,null,Printing machinery and equipment manufacturing
333294,null,Food product machinery manufacturing
333295,null,Semiconductor machinery manufacturing
333298,null,All other industrial machinery manufacturing
333311,null,Automatic vending machine manufacturing
333312,null,"Commercial laundry, drycleaning, and pressing machine manufacturing"
333313,null,Office machinery manufacturing
333314,null,Optical instrument and lens manufacturing
333315,null,Photographic and photocopying equipment manufacturing
333319,null,Other commercial and service industry machinery manufacturing
333411,null,Air purification equipment manufacturing
333412,null,Industrial and commercial fan and blower manufacturing
333414,null,Heating equipment (except warm air furnaces) manufacturing
333415,null,Air-conditioning and warm air heating equipment and commercial and industrial refrigeration equipment manufacturing
333511,null,Industrial mold manufacturing
333512,null,Machine tool (metal cutting types) manufacturing
333513,null,Machine tool (metal forming types) manufacturing
333514,null,"Special die and tool, die set, jig, and fixture manufacturing"
333515,null,Cutting tool and machine tool accessory manufacturing
333516,null,Rolling mill machinery and equipment manufacturing
333518,null,Other metalworking machinery manufacturing
333611,null,Turbine and turbine generator set units manufacturing
333612,null,"Speed changer, industrial high-speed drive, and gear manufacturing"
333613,null,Mechanical power transmission equipment manufacturing
333618,null,Other engine equipment manufacturing
333911,null,Pump and pumping equipment manufacturing
333912,null,Air and gas compressor manufacturing
333913,null,Measuring and dispensing pump manufacturing
333921,null,Elevator and moving stairway manufacturing
333922,null,Conveyor and conveying equipment manufacturing
333923,null,"Overhead traveling crane, hoist, and monorail system manufacturing"
333924,null,"Industrial truck, trailer, and stacker machinery manufacturing"
333991,null,Power-driven handtool manufacturing
333992,null,Welding and soldering equipment manufacturing
333993,null,Packaging machinery manufacturing
333994,null,Industrial process furnace and oven manufacturing
333995,null,Fluid power cylinder and actuator manufacturing
333996,null,Fluid power pump and motor manufacturing
333997,null,Scale and balance manufacturing
333999,null,All other miscellaneous general purpose machinery manufacturing
334111,null,Electronic computer manufacturing
334112,null,Computer storage device manufacturing
334113,null,Computer terminal manufacturing
334119,null,Other computer peripheral equipment manufacturing
334210,null,Telephone apparatus manufacturing
334220,null,Radio and television broadcasting and wireless communications equipment manufacturing
334290,null,Other communications equipment manufacturing
334310,null,Audio and video equipment manufacturing
334411,null,Electron tube manufacturing
334412,null,Bare printed circuit board manufacturing
334413,null,Semiconductor and related device manufacturing
334414,null,Electronic capacitor manufacturing
334415,null,Electronic resistor manufacturing
334416,null,"Electronic coil, transformer, and other inductor manufacturing"
334417,null,Electronic connector manufacturing
334418,null,Printed circuit assembly (electronic assembly) manufacturing
334419,null,Other electronic component manufacturing
334510,null,Electromedical and electrotherapeutic apparatus manufacturing
334511,null,"Search, detection, navigation, guidance, aeronautical, and nautical system and instrument manufacturing"
334512,null,"Automatic environmental control manufacturing for residential, commercial, and appliance use"
334513,null,"Instruments and related products manufacturing for measuring, displaying, and controlling industrial process variables"
334514,null,Totalizing fluid meter and counting device manufacturing
334515,null,Instrument manufacturing for measuring and testing electricity and electrical systems
334516,null,Analytical laboratory instrument manufacturing
334517,null,Irradiation apparatus manufacturing
334518,null,"Watch, clock, and part manufacturing"
334519,null,Other measuring and controlling device manufacturing
334611,null,Software reproducing
334612,null,"Prerecorded compact disc (except software), tape, and record reproducing"
334613,null,Magnetic and optical recording media manufacturing
335110,null,Electric lamp bulb and part manufacturing
335121,null,Residential electric lighting fixture manufacturing
335122,null,"Commercial, industrial, and institutional electric lighting fixture manufacturing"
335129,null,Other lighting equipment manufacturing
335211,null,Electric housewares and household fan manufacturing
335212,null,Household vacuum cleaner manufacturing
335221,null,Household cooking appliance manufacturing
335222,null,Household refrigerator and home freezer manufacturing
335224,null,Household laundry equipment manufacturing
335228,null,Other major household appliance manufacturing
335311,null,"Power, distribution, and specialty transformer manufacturing"
335312,null,Motor and generator manufacturing
335313,null,Switchgear and switchboard apparatus manufacturing
335314,null,Relay and industrial control manufacturing
335911,null,Storage battery manufacturing
335912,null,Primary battery manufacturing
335921,null,Fiber optic cable manufacturing
335929,null,Other communication and energy wire manufacturing
335931,null,Current-carrying wiring device manufacturing
335932,null,Noncurrent-carrying wiring device manufacturing
335991,null,Carbon and graphite product manufacturing
335999,null,All other miscellaneous electrical equipment and component manufacturing
336111,null,Automobile manufacturing
336112,null,Light truck and utility vehicle manufacturing
336120,null,Heavy duty truck manufacturing
336211,null,Motor vehicle body manufacturing
336212,null,Truck trailer manufacturing
336213,null,Motor home manufacturing
336214,null,Travel trailer and camper manufacturing
336311,null,"Carburetor, piston, piston ring, and valve manufacturing"
336312,null,Gasoline engine and engine parts manufacturing
336321,null,Vehicular lighting equipment manufacturing
336322,null,Other motor vehicle electrical and electronic equipment manufacturing
336330,null,Motor vehicle steering and suspension components (except spring) manufacturing
336340,null,Motor vehicle brake system manufacturing
336350,null,Motor vehicle transmission and power train parts manufacturing
336360,null,Motor vehicle seating and interior trim manufacturing
336370,null,Motor vehicle metal stamping
336391,null,Motor vehicle air-conditioning manufacturing
336399,null,All other motor vehicle parts manufacturing
336411,null,Aircraft manufacturing
336412,null,Aircraft engine and engine parts manufacturing
336413,null,Other aircraft parts and auxiliary equipment manufacturing
336414,null,Guided missile and space vehicle manufacturing
336415,null,Guided missile and space vehicle propulsion unit and propulsion unit parts manufacturing
336419,null,Other guided missile and space vehicle parts and auxiliary equipment manufacturing
336510,null,Railroad rolling stock manufacturing
336611,null,Ship building and repairing
336612,null,Boat building
336991,null,"Motorcycle, bicycle, and parts manufacturing"
336992,null,"Military armored vehicle, tank, and tank component manufacturing"
336999,null,All other transportation equipment manufacturing
337110,null,Wood kitchen cabinet and countertop manufacturing
337121,null,Upholstered household furniture manufacturing
337122,null,Nonupholstered wood household furniture manufacturing
337124,null,Metal household furniture manufacturing
337125,null,Household furniture (except wood and metal) manufacturing
337127,null,Institutional furniture manufacturing
337129,null,"Wood television, radio, and sewing machine cabinet manufacturing"
337211,null,Wood office furniture manufacturing
337212,null,Custom architectural woodwork and millwork manufacturing
337214,null,Office furniture (except wood) manufacturing
337215,null,"Showcase, partition, shelving, and locker manufacturing"
337910,null,Mattress manufacturing
337920,null,Blind and shade manufacturing
339112,null,Surgical and medical instrument manufacturing
339113,null,Surgical appliance and supplies manufacturing
339114,null,Dental equipment and supplies manufacturing
339115,null,Ophthalmic goods manufacturing
